{
  "artifact": {
    "id": "spec-backlog-001",
    "version": 1,
    "source_stage": "spec_drafting",
    "next_stage": "policy_assignment",
    "status": "ready",
    "risk_tier": "medium",
    "owner_agent": "Clarifier",
    "rollback_class": "reversible_deploy",
    "created_at": "2026-04-22T12:15:00Z",
    "updated_at": "2026-04-22T12:40:00Z"
  },
  "source": {
    "provider": "anthropic",
    "kind": "changelog",
    "external_id": "feature-2026-04-backlog",
    "title": "Customer-facing configurable citation formatting",
    "url": "https://example.com/anthropic/changelog/feature-2026-04-backlog",
    "detected_at": "2026-04-22T12:00:00Z"
  },
  "summary": {
    "problem": "Citation formatting options would be valuable, but the product surface and UX are not yet settled.",
    "proposed_capability": "Track a guarded-lane candidate for later implementation once the product requirements are stable.",
    "why_now": "The upstream capability is relevant, but current milestones do not justify immediate execution.",
    "affected_surfaces": [
      "user_experience",
      "llm_output"
    ],
    "assumptions": [
      "The change would remain feature-flagged if adopted later."
    ],
    "non_goals": [
      "Do not begin implementation in the current sprint."
    ]
  },
  "acceptance_criteria": [
    {
      "id": "ac-backlog-001",
      "description": "Document the candidate and preserve enough detail to revisit it later.",
      "verification_method": "manual",
      "required": true
    }
  ],
  "open_questions": [
    {
      "id": "q-backlog-001",
      "question": "What citation formats should be exposed to end users?",
      "blocking": false,
      "resolution_status": "unresolved"
    }
  ],
  "risk_profile": {
    "risk_score": 35,
    "data_classification": "internal",
    "blast_radius": "customer_facing",
    "rollback_class": "reversible_deploy",
    "factors": [
      {
        "name": "user_visible",
        "score": 15,
        "notes": "Output formatting affects the user-visible surface."
      },
      {
        "name": "model_behavior_change",
        "score": 20,
        "notes": "Formatting changes alter LLM output behavior."
      }
    ]
  },
  "relevance": {
    "decision": "backlog_candidate",
    "rationale": "The feature is worth tracking but should not enter the active build queue yet.",
    "confidence": 0.79,
    "expected_roi": "medium",
    "enqueue": false
  }
}
